[I 2025-07-27 19:30:20,708] Using an existing study with name 'eisbach_pure_test' instead of creating a new one.
[I 2025-07-27 19:30:20,708] Using an existing study with name 'eisbach_pure_test' instead of creating a new one.
[I 2025-07-27 19:30:20,708] Using an existing study with name 'eisbach_pure_test' instead of creating a new one.
[I 2025-07-27 19:30:20,709] Using an existing study with name 'eisbach_pure_test' instead of creating a new one.
[I 2025-07-27 19:36:26,044] Using an existing study with name 'eisbach_pure_test' instead of creating a new one.
[I 2025-07-27 19:36:26,044] Using an existing study with name 'eisbach_pure_test' instead of creating a new one.
[I 2025-07-27 19:36:26,044] Using an existing study with name 'eisbach_pure_test' instead of creating a new one.
[I 2025-07-27 19:36:26,044] Using an existing study with name 'eisbach_pure_test' instead of creating a new one.
[I 2025-07-27 19:36:26,044] Using an existing study with name 'eisbach_pure_test' instead of creating a new one.
[I 2025-07-27 19:36:26,044] Using an existing study with name 'eisbach_pure_test' instead of creating a new one.
[I 2025-07-27 19:36:26,045] Using an existing study with name 'eisbach_pure_test' instead of creating a new one.
[I 2025-07-27 19:36:26,045] Using an existing study with name 'eisbach_pure_test' instead of creating a new one.
[I 2025-07-27 19:36:26,045] Using an existing study with name 'eisbach_pure_test' instead of creating a new one.
[I 2025-07-27 19:36:26,046] Using an existing study with name 'eisbach_pure_test' instead of creating a new one.
[I 2025-07-27 19:36:26,046] Using an existing study with name 'eisbach_pure_test' instead of creating a new one.
[I 2025-07-27 19:36:26,047] Using an existing study with name 'eisbach_pure_test' instead of creating a new one.
[I 2025-07-27 19:36:26,047] Using an existing study with name 'eisbach_pure_test' instead of creating a new one.
[I 2025-07-27 19:36:26,052] Using an existing study with name 'eisbach_pure_test' instead of creating a new one.
[I 2025-07-27 19:36:26,062] Using an existing study with name 'eisbach_pure_test' instead of creating a new one.
[I 2025-07-27 19:36:26,244] Using an existing study with name 'eisbach_pure_test' instead of creating a new one.
[I 2025-07-27 19:36:41,380] Trial 19 pruned. Full training run failed: CUDA out of memory. Tried to allocate 20.00 MiB. GPU 0 has a total capacity of 15.48 GiB of which 19.88 MiB is free. Process 269485 has 480.00 MiB memory in use. Process 269482 has 552.00 MiB memory in use. Process 269484 has 670.00 MiB memory in use. Process 269490 has 1.78 GiB memory in use. Process 269486 has 1.13 GiB memory in use. Including non-PyTorch memory, this process has 548.00 MiB memory in use. Process 269488 has 464.00 MiB memory in use. Process 269477 has 476.00 MiB memory in use. Process 269492 has 846.00 MiB memory in use. Process 269479 has 1.85 GiB memory in use. Process 269491 has 836.00 MiB memory in use. Process 269478 has 908.00 MiB memory in use. Process 269483 has 1.69 GiB memory in use. Process 269481 has 866.00 MiB memory in use. Process 269487 has 548.00 MiB memory in use. Process 269489 has 1.89 GiB memory in use. Of the allocated memory 196.53 MiB is allocated by PyTorch, and 69.47 MiB is reserved by PyTorch but unallocated. If reserved but unallocated memory is large try setting PYTORCH_CUDA_ALLOC_CONF=expandable_segments:True to avoid fragmentation.  See documentation for Memory Management  (https://pytorch.org/docs/stable/notes/cuda.html#environment-variables)
[I 2025-07-27 19:36:45,115] Trial 27 pruned. Full training run failed: CUDA out of memory. Tried to allocate 38.00 MiB. GPU 0 has a total capacity of 15.48 GiB of which 25.88 MiB is free. Process 269485 has 480.00 MiB memory in use. Process 269482 has 552.00 MiB memory in use. Process 269484 has 670.00 MiB memory in use. Process 269490 has 1.78 GiB memory in use. Process 269486 has 1.14 GiB memory in use. Including non-PyTorch memory, this process has 532.00 MiB memory in use. Process 269488 has 464.00 MiB memory in use. Process 269477 has 476.00 MiB memory in use. Process 269492 has 846.00 MiB memory in use. Process 269479 has 1.85 GiB memory in use. Process 269491 has 836.00 MiB memory in use. Process 269478 has 910.00 MiB memory in use. Process 269483 has 1.69 GiB memory in use. Process 269481 has 870.00 MiB memory in use. Process 269487 has 548.00 MiB memory in use. Process 269489 has 1.89 GiB memory in use. Of the allocated memory 226.71 MiB is allocated by PyTorch, and 23.29 MiB is reserved by PyTorch but unallocated. If reserved but unallocated memory is large try setting PYTORCH_CUDA_ALLOC_CONF=expandable_segments:True to avoid fragmentation.  See documentation for Memory Management  (https://pytorch.org/docs/stable/notes/cuda.html#environment-variables)
[I 2025-07-27 19:36:48,545] Trial 28 pruned. Full training run failed: CUDA out of memory. Tried to allocate 20.00 MiB. GPU 0 has a total capacity of 15.48 GiB of which 11.88 MiB is free. Process 269485 has 480.00 MiB memory in use. Process 269482 has 552.00 MiB memory in use. Process 269484 has 670.00 MiB memory in use. Process 269490 has 1.78 GiB memory in use. Process 269486 has 1.14 GiB memory in use. Including non-PyTorch memory, this process has 536.00 MiB memory in use. Process 269488 has 464.00 MiB memory in use. Process 269477 has 476.00 MiB memory in use. Process 269492 has 848.00 MiB memory in use. Process 269479 has 1.85 GiB memory in use. Process 269491 has 836.00 MiB memory in use. Process 269478 has 910.00 MiB memory in use. Process 269483 has 1.69 GiB memory in use. Process 269481 has 872.00 MiB memory in use. Process 269487 has 548.00 MiB memory in use. Process 269489 has 1.89 GiB memory in use. Of the allocated memory 236.22 MiB is allocated by PyTorch, and 17.78 MiB is reserved by PyTorch but unallocated. If reserved but unallocated memory is large try setting PYTORCH_CUDA_ALLOC_CONF=expandable_segments:True to avoid fragmentation.  See documentation for Memory Management  (https://pytorch.org/docs/stable/notes/cuda.html#environment-variables)
[I 2025-07-27 19:36:51,783] Trial 29 pruned. Full training run failed: The following operation failed in the TorchScript interpreter.
Traceback of TorchScript (most recent call last):
RuntimeError: The following operation failed in the TorchScript interpreter.
Traceback of TorchScript (most recent call last):
RuntimeError: CUDA out of memory. Tried to allocate 2.00 MiB. GPU 0 has a total capacity of 15.48 GiB of which 1.88 MiB is free. Process 269485 has 480.00 MiB memory in use. Process 269482 has 554.00 MiB memory in use. Process 269484 has 670.00 MiB memory in use. Process 269490 has 1.78 GiB memory in use. Process 269486 has 1.14 GiB memory in use. Including non-PyTorch memory, this process has 542.00 MiB memory in use. Process 269488 has 464.00 MiB memory in use. Process 269477 has 476.00 MiB memory in use. Process 269492 has 848.00 MiB memory in use. Process 269479 has 1.85 GiB memory in use. Process 269491 has 836.00 MiB memory in use. Process 269478 has 910.00 MiB memory in use. Process 269483 has 1.69 GiB memory in use. Process 269481 has 874.00 MiB memory in use. Process 269487 has 548.00 MiB memory in use. Process 269489 has 1.89 GiB memory in use. Of the allocated memory 236.40 MiB is allocated by PyTorch, and 23.60 MiB is reserved by PyTorch but unallocated. If reserved but unallocated memory is large try setting PYTORCH_CUDA_ALLOC_CONF=expandable_segments:True to avoid fragmentation.  See documentation for Memory Management  (https://pytorch.org/docs/stable/notes/cuda.html#environment-variables)


[I 2025-07-27 19:36:54,450] Trial 30 pruned. Full training run failed: CUDA out of memory. Tried to allocate 20.00 MiB. GPU 0 has a total capacity of 15.48 GiB of which 13.88 MiB is free. Process 269485 has 480.00 MiB memory in use. Process 269482 has 554.00 MiB memory in use. Process 269484 has 670.00 MiB memory in use. Process 269490 has 1.78 GiB memory in use. Process 269486 has 1.14 GiB memory in use. Including non-PyTorch memory, this process has 530.00 MiB memory in use. Process 269488 has 464.00 MiB memory in use. Process 269477 has 476.00 MiB memory in use. Process 269492 has 848.00 MiB memory in use. Process 269479 has 1.85 GiB memory in use. Process 269491 has 836.00 MiB memory in use. Process 269478 has 910.00 MiB memory in use. Process 269483 has 1.69 GiB memory in use. Process 269481 has 874.00 MiB memory in use. Process 269487 has 548.00 MiB memory in use. Process 269489 has 1.89 GiB memory in use. Of the allocated memory 221.52 MiB is allocated by PyTorch, and 26.48 MiB is reserved by PyTorch but unallocated. If reserved but unallocated memory is large try setting PYTORCH_CUDA_ALLOC_CONF=expandable_segments:True to avoid fragmentation.  See documentation for Memory Management  (https://pytorch.org/docs/stable/notes/cuda.html#environment-variables)
[I 2025-07-27 19:36:57,561] Trial 31 pruned. Full training run failed: CUDA out of memory. Tried to allocate 20.00 MiB. GPU 0 has a total capacity of 15.48 GiB of which 1.88 MiB is free. Process 269485 has 480.00 MiB memory in use. Process 269482 has 554.00 MiB memory in use. Process 269484 has 670.00 MiB memory in use. Process 269490 has 1.78 GiB memory in use. Process 269486 has 1.14 GiB memory in use. Including non-PyTorch memory, this process has 538.00 MiB memory in use. Process 269488 has 464.00 MiB memory in use. Process 269477 has 476.00 MiB memory in use. Process 269492 has 848.00 MiB memory in use. Process 269479 has 1.85 GiB memory in use. Process 269491 has 838.00 MiB memory in use. Process 269478 has 912.00 MiB memory in use. Process 269483 has 1.69 GiB memory in use. Process 269481 has 874.00 MiB memory in use. Process 269487 has 548.00 MiB memory in use. Process 269489 has 1.89 GiB memory in use. Of the allocated memory 243.04 MiB is allocated by PyTorch, and 12.96 MiB is reserved by PyTorch but unallocated. If reserved but unallocated memory is large try setting PYTORCH_CUDA_ALLOC_CONF=expandable_segments:True to avoid fragmentation.  See documentation for Memory Management  (https://pytorch.org/docs/stable/notes/cuda.html#environment-variables)
[I 2025-07-27 19:37:00,647] Trial 32 pruned. Full training run failed: CUDA out of memory. Tried to allocate 20.00 MiB. GPU 0 has a total capacity of 15.48 GiB of which 1.88 MiB is free. Process 269485 has 480.00 MiB memory in use. Process 269482 has 554.00 MiB memory in use. Process 269484 has 670.00 MiB memory in use. Process 269490 has 1.78 GiB memory in use. Process 269486 has 1.14 GiB memory in use. Including non-PyTorch memory, this process has 538.00 MiB memory in use. Process 269488 has 464.00 MiB memory in use. Process 269477 has 476.00 MiB memory in use. Process 269492 has 848.00 MiB memory in use. Process 269479 has 1.85 GiB memory in use. Process 269491 has 838.00 MiB memory in use. Process 269478 has 912.00 MiB memory in use. Process 269483 has 1.69 GiB memory in use. Process 269481 has 874.00 MiB memory in use. Process 269487 has 548.00 MiB memory in use. Process 269489 has 1.89 GiB memory in use. Of the allocated memory 239.87 MiB is allocated by PyTorch, and 16.13 MiB is reserved by PyTorch but unallocated. If reserved but unallocated memory is large try setting PYTORCH_CUDA_ALLOC_CONF=expandable_segments:True to avoid fragmentation.  See documentation for Memory Management  (https://pytorch.org/docs/stable/notes/cuda.html#environment-variables)
[I 2025-07-27 19:37:05,076] Trial 33 pruned. Full training run failed: CUDA out of memory. Tried to allocate 20.00 MiB. GPU 0 has a total capacity of 15.48 GiB of which 15.88 MiB is free. Process 269485 has 480.00 MiB memory in use. Process 269482 has 554.00 MiB memory in use. Process 269484 has 670.00 MiB memory in use. Process 269490 has 1.77 GiB memory in use. Process 269486 has 1.14 GiB memory in use. Including non-PyTorch memory, this process has 536.00 MiB memory in use. Process 269488 has 464.00 MiB memory in use. Process 269477 has 476.00 MiB memory in use. Process 269492 has 848.00 MiB memory in use. Process 269479 has 1.85 GiB memory in use. Process 269491 has 838.00 MiB memory in use. Process 269478 has 912.00 MiB memory in use. Process 269483 has 1.69 GiB memory in use. Process 269481 has 874.00 MiB memory in use. Process 269487 has 548.00 MiB memory in use. Process 269489 has 1.89 GiB memory in use. Of the allocated memory 236.68 MiB is allocated by PyTorch, and 17.32 MiB is reserved by PyTorch but unallocated. If reserved but unallocated memory is large try setting PYTORCH_CUDA_ALLOC_CONF=expandable_segments:True to avoid fragmentation.  See documentation for Memory Management  (https://pytorch.org/docs/stable/notes/cuda.html#environment-variables)
[I 2025-07-27 19:37:08,980] Trial 34 pruned. Full training run failed: CUDA out of memory. Tried to allocate 20.00 MiB. GPU 0 has a total capacity of 15.48 GiB of which 17.88 MiB is free. Process 269485 has 480.00 MiB memory in use. Process 269482 has 554.00 MiB memory in use. Process 269484 has 670.00 MiB memory in use. Process 269490 has 1.77 GiB memory in use. Process 269486 has 1.14 GiB memory in use. Including non-PyTorch memory, this process has 534.00 MiB memory in use. Process 269488 has 464.00 MiB memory in use. Process 269477 has 476.00 MiB memory in use. Process 269492 has 848.00 MiB memory in use. Process 269479 has 1.85 GiB memory in use. Process 269491 has 838.00 MiB memory in use. Process 269478 has 912.00 MiB memory in use. Process 269483 has 1.69 GiB memory in use. Process 269481 has 874.00 MiB memory in use. Process 269487 has 548.00 MiB memory in use. Process 269489 has 1.89 GiB memory in use. Of the allocated memory 229.02 MiB is allocated by PyTorch, and 22.98 MiB is reserved by PyTorch but unallocated. If reserved but unallocated memory is large try setting PYTORCH_CUDA_ALLOC_CONF=expandable_segments:True to avoid fragmentation.  See documentation for Memory Management  (https://pytorch.org/docs/stable/notes/cuda.html#environment-variables)
[I 2025-07-27 19:37:12,538] Trial 35 pruned. Full training run failed: CUDA out of memory. Tried to allocate 32.00 MiB. GPU 0 has a total capacity of 15.48 GiB of which 29.88 MiB is free. Process 269485 has 480.00 MiB memory in use. Process 269482 has 554.00 MiB memory in use. Process 269484 has 670.00 MiB memory in use. Process 269490 has 1.77 GiB memory in use. Process 269486 has 1.14 GiB memory in use. Including non-PyTorch memory, this process has 522.00 MiB memory in use. Process 269488 has 464.00 MiB memory in use. Process 269477 has 476.00 MiB memory in use. Process 269492 has 848.00 MiB memory in use. Process 269479 has 1.85 GiB memory in use. Process 269491 has 838.00 MiB memory in use. Process 269478 has 912.00 MiB memory in use. Process 269483 has 1.69 GiB memory in use. Process 269481 has 874.00 MiB memory in use. Process 269487 has 548.00 MiB memory in use. Process 269489 has 1.89 GiB memory in use. Of the allocated memory 233.95 MiB is allocated by PyTorch, and 6.05 MiB is reserved by PyTorch but unallocated. If reserved but unallocated memory is large try setting PYTORCH_CUDA_ALLOC_CONF=expandable_segments:True to avoid fragmentation.  See documentation for Memory Management  (https://pytorch.org/docs/stable/notes/cuda.html#environment-variables)
[I 2025-07-27 19:37:15,869] Trial 36 pruned. Full training run failed: CUDA out of memory. Tried to allocate 20.00 MiB. GPU 0 has a total capacity of 15.48 GiB of which 17.88 MiB is free. Process 269485 has 480.00 MiB memory in use. Process 269482 has 554.00 MiB memory in use. Process 269484 has 670.00 MiB memory in use. Process 269490 has 1.77 GiB memory in use. Process 269486 has 1.14 GiB memory in use. Including non-PyTorch memory, this process has 534.00 MiB memory in use. Process 269488 has 464.00 MiB memory in use. Process 269477 has 476.00 MiB memory in use. Process 269492 has 848.00 MiB memory in use. Process 269479 has 1.85 GiB memory in use. Process 269491 has 838.00 MiB memory in use. Process 269478 has 912.00 MiB memory in use. Process 269483 has 1.69 GiB memory in use. Process 269481 has 874.00 MiB memory in use. Process 269487 has 548.00 MiB memory in use. Process 269489 has 1.89 GiB memory in use. Of the allocated memory 200.77 MiB is allocated by PyTorch, and 51.23 MiB is reserved by PyTorch but unallocated. If reserved but unallocated memory is large try setting PYTORCH_CUDA_ALLOC_CONF=expandable_segments:True to avoid fragmentation.  See documentation for Memory Management  (https://pytorch.org/docs/stable/notes/cuda.html#environment-variables)
[I 2025-07-27 19:37:18,453] Trial 37 pruned. Full training run failed: The following operation failed in the TorchScript interpreter.
Traceback of TorchScript (most recent call last):
RuntimeError: The following operation failed in the TorchScript interpreter.
Traceback of TorchScript (most recent call last):
RuntimeError: CUDA out of memory. Tried to allocate 2.00 MiB. GPU 0 has a total capacity of 15.48 GiB of which 1.88 MiB is free. Process 269485 has 480.00 MiB memory in use. Process 269482 has 554.00 MiB memory in use. Process 269484 has 670.00 MiB memory in use. Process 269490 has 1.78 GiB memory in use. Process 269486 has 1.14 GiB memory in use. Including non-PyTorch memory, this process has 546.00 MiB memory in use. Process 269488 has 464.00 MiB memory in use. Process 269477 has 476.00 MiB memory in use. Process 269492 has 848.00 MiB memory in use. Process 269479 has 1.85 GiB memory in use. Process 269491 has 838.00 MiB memory in use. Process 269478 has 912.00 MiB memory in use. Process 269483 has 1.69 GiB memory in use. Process 269481 has 874.00 MiB memory in use. Process 269487 has 548.00 MiB memory in use. Process 269489 has 1.89 GiB memory in use. Of the allocated memory 233.16 MiB is allocated by PyTorch, and 30.84 MiB is reserved by PyTorch but unallocated. If reserved but unallocated memory is large try setting PYTORCH_CUDA_ALLOC_CONF=expandable_segments:True to avoid fragmentation.  See documentation for Memory Management  (https://pytorch.org/docs/stable/notes/cuda.html#environment-variables)


[I 2025-07-27 19:37:21,892] Trial 38 pruned. Full training run failed: CUDA out of memory. Tried to allocate 20.00 MiB. GPU 0 has a total capacity of 15.48 GiB of which 11.88 MiB is free. Process 269485 has 480.00 MiB memory in use. Process 269482 has 554.00 MiB memory in use. Process 269484 has 670.00 MiB memory in use. Process 269490 has 1.78 GiB memory in use. Process 269486 has 1.14 GiB memory in use. Including non-PyTorch memory, this process has 536.00 MiB memory in use. Process 269488 has 464.00 MiB memory in use. Process 269477 has 476.00 MiB memory in use. Process 269492 has 848.00 MiB memory in use. Process 269479 has 1.85 GiB memory in use. Process 269491 has 838.00 MiB memory in use. Process 269478 has 912.00 MiB memory in use. Process 269483 has 1.69 GiB memory in use. Process 269481 has 874.00 MiB memory in use. Process 269487 has 548.00 MiB memory in use. Process 269489 has 1.89 GiB memory in use. Of the allocated memory 244.73 MiB is allocated by PyTorch, and 9.27 MiB is reserved by PyTorch but unallocated. If reserved but unallocated memory is large try setting PYTORCH_CUDA_ALLOC_CONF=expandable_segments:True to avoid fragmentation.  See documentation for Memory Management  (https://pytorch.org/docs/stable/notes/cuda.html#environment-variables)
[I 2025-07-27 19:37:25,459] Trial 39 pruned. Full training run failed: CUDA out of memory. Tried to allocate 40.00 MiB. GPU 0 has a total capacity of 15.48 GiB of which 13.88 MiB is free. Process 269485 has 480.00 MiB memory in use. Process 269482 has 554.00 MiB memory in use. Process 269484 has 670.00 MiB memory in use. Process 269490 has 1.78 GiB memory in use. Process 269486 has 1.14 GiB memory in use. Including non-PyTorch memory, this process has 534.00 MiB memory in use. Process 269488 has 464.00 MiB memory in use. Process 269477 has 476.00 MiB memory in use. Process 269492 has 848.00 MiB memory in use. Process 269479 has 1.85 GiB memory in use. Process 269491 has 838.00 MiB memory in use. Process 269478 has 912.00 MiB memory in use. Process 269483 has 1.69 GiB memory in use. Process 269481 has 874.00 MiB memory in use. Process 269487 has 548.00 MiB memory in use. Process 269489 has 1.89 GiB memory in use. Of the allocated memory 216.30 MiB is allocated by PyTorch, and 35.70 MiB is reserved by PyTorch but unallocated. If reserved but unallocated memory is large try setting PYTORCH_CUDA_ALLOC_CONF=expandable_segments:True to avoid fragmentation.  See documentation for Memory Management  (https://pytorch.org/docs/stable/notes/cuda.html#environment-variables)
