[I 2025-07-27 19:37:29,365] Trial 40 pruned. Full training run failed: CUDA out of memory. Tried to allocate 20.00 MiB. GPU 0 has a total capacity of 15.48 GiB of which 13.88 MiB is free. Process 269485 has 480.00 MiB memory in use. Process 269482 has 554.00 MiB memory in use. Process 269484 has 670.00 MiB memory in use. Process 269490 has 1.78 GiB memory in use. Process 269486 has 1.14 GiB memory in use. Including non-PyTorch memory, this process has 534.00 MiB memory in use. Process 269488 has 464.00 MiB memory in use. Process 269477 has 476.00 MiB memory in use. Process 269492 has 848.00 MiB memory in use. Process 269479 has 1.85 GiB memory in use. Process 269491 has 838.00 MiB memory in use. Process 269478 has 912.00 MiB memory in use. Process 269483 has 1.69 GiB memory in use. Process 269481 has 874.00 MiB memory in use. Process 269487 has 548.00 MiB memory in use. Process 269489 has 1.89 GiB memory in use. Of the allocated memory 229.17 MiB is allocated by PyTorch, and 22.83 MiB is reserved by PyTorch but unallocated. If reserved but unallocated memory is large try setting PYTORCH_CUDA_ALLOC_CONF=expandable_segments:True to avoid fragmentation.  See documentation for Memory Management  (https://pytorch.org/docs/stable/notes/cuda.html#environment-variables)
[I 2025-07-27 19:38:17,288] Trial 23 pruned. Full training run failed: CUDA out of memory. Tried to allocate 76.00 MiB. GPU 0 has a total capacity of 15.48 GiB of which 67.88 MiB is free. Process 269485 has 480.00 MiB memory in use. Process 269482 has 556.00 MiB memory in use. Process 269484 has 670.00 MiB memory in use. Process 269490 has 1.80 GiB memory in use. Process 269486 has 1.14 GiB memory in use. Process 269480 has 534.00 MiB memory in use. Process 269488 has 466.00 MiB memory in use. Process 269477 has 476.00 MiB memory in use. Process 269492 has 848.00 MiB memory in use. Including non-PyTorch memory, this process has 1.72 GiB memory in use. Process 269491 has 858.00 MiB memory in use. Process 269478 has 912.00 MiB memory in use. Process 269483 has 1.69 GiB memory in use. Process 269481 has 896.00 MiB memory in use. Process 269487 has 548.00 MiB memory in use. Process 269489 has 1.89 GiB memory in use. Of the allocated memory 1.36 GiB is allocated by PyTorch, and 94.61 MiB is reserved by PyTorch but unallocated. If reserved but unallocated memory is large try setting PYTORCH_CUDA_ALLOC_CONF=expandable_segments:True to avoid fragmentation.  See documentation for Memory Management  (https://pytorch.org/docs/stable/notes/cuda.html#environment-variables)
[I 2025-07-27 19:39:26,458] Trial 12 pruned. Full training run failed: CUDA out of memory. Tried to allocate 20.00 MiB. GPU 0 has a total capacity of 15.48 GiB of which 19.88 MiB is free. Process 269485 has 480.00 MiB memory in use. Process 269482 has 556.00 MiB memory in use. Including non-PyTorch memory, this process has 658.00 MiB memory in use. Process 269490 has 1.81 GiB memory in use. Process 269486 has 1.14 GiB memory in use. Process 269480 has 534.00 MiB memory in use. Process 269488 has 466.00 MiB memory in use. Process 269477 has 476.00 MiB memory in use. Process 269492 has 848.00 MiB memory in use. Process 269479 has 1.72 GiB memory in use. Process 269491 has 858.00 MiB memory in use. Process 269478 has 922.00 MiB memory in use. Process 269483 has 1.73 GiB memory in use. Process 269481 has 896.00 MiB memory in use. Process 269487 has 548.00 MiB memory in use. Process 269489 has 1.89 GiB memory in use. Of the allocated memory 343.32 MiB is allocated by PyTorch, and 32.68 MiB is reserved by PyTorch but unallocated. If reserved but unallocated memory is large try setting PYTORCH_CUDA_ALLOC_CONF=expandable_segments:True to avoid fragmentation.  See documentation for Memory Management  (https://pytorch.org/docs/stable/notes/cuda.html#environment-variables)
[I 2025-07-27 19:40:04,206] Trial 15 pruned. Full training run failed: CUDA out of memory. Tried to allocate 20.00 MiB. GPU 0 has a total capacity of 15.48 GiB of which 19.88 MiB is free. Process 269485 has 480.00 MiB memory in use. Process 269482 has 556.00 MiB memory in use. Process 269484 has 658.00 MiB memory in use. Process 269490 has 1.81 GiB memory in use. Process 269486 has 1.14 GiB memory in use. Process 269480 has 534.00 MiB memory in use. Process 269488 has 466.00 MiB memory in use. Process 269477 has 476.00 MiB memory in use. Process 269492 has 848.00 MiB memory in use. Process 269479 has 1.72 GiB memory in use. Process 269491 has 858.00 MiB memory in use. Including non-PyTorch memory, this process has 920.00 MiB memory in use. Process 269483 has 1.73 GiB memory in use. Process 269481 has 898.00 MiB memory in use. Process 269487 has 548.00 MiB memory in use. Process 269489 has 1.89 GiB memory in use. Of the allocated memory 558.65 MiB is allocated by PyTorch, and 79.35 MiB is reserved by PyTorch but unallocated. If reserved but unallocated memory is large try setting PYTORCH_CUDA_ALLOC_CONF=expandable_segments:True to avoid fragmentation.  See documentation for Memory Management  (https://pytorch.org/docs/stable/notes/cuda.html#environment-variables)
[I 2025-07-27 19:43:28,488] Using an existing study with name 'eisbach_pure_test' instead of creating a new one.
[I 2025-07-27 19:43:28,488] Using an existing study with name 'eisbach_pure_test' instead of creating a new one.
[I 2025-07-27 19:43:28,488] Using an existing study with name 'eisbach_pure_test' instead of creating a new one.
[I 2025-07-27 19:43:28,489] Using an existing study with name 'eisbach_pure_test' instead of creating a new one.
[I 2025-07-27 19:43:28,489] Using an existing study with name 'eisbach_pure_test' instead of creating a new one.
[I 2025-07-27 19:43:28,489] Using an existing study with name 'eisbach_pure_test' instead of creating a new one.
[I 2025-07-27 19:43:28,491] Using an existing study with name 'eisbach_pure_test' instead of creating a new one.
[I 2025-07-27 19:43:28,496] Using an existing study with name 'eisbach_pure_test' instead of creating a new one.
[I 2025-07-27 19:49:22,821] Trial 45 pruned. 
[I 2025-07-27 19:49:26,355] Trial 46 pruned. 
[I 2025-07-27 19:49:27,049] Trial 48 pruned. 
[I 2025-07-27 19:49:27,940] Trial 51 pruned. 
[I 2025-07-27 19:49:28,088] Trial 47 pruned. 
[I 2025-07-27 19:54:39,847] Trial 56 pruned. 
[I 2025-07-27 19:54:40,079] Trial 57 pruned. 
[I 2025-07-27 19:58:13,944] Trial 53 pruned. 
[I 2025-07-27 20:00:16,953] Trial 59 pruned. 
[I 2025-07-27 20:03:38,073] Trial 58 finished with value: 3.1854851245880127 and parameters: {'seq_len': 192, 'norm_mode': 'subtract_median', 'lr': 0.005277960048923125, 'd_model': 512, 'd_ff': 128, 'e_layers': 2, 'moving_avg': 49, 'n_heads': 4, 'dropout': 0.3044405607548762, 'fc_dropout': 0.20646821015506506, 'batch_size': 1024, 'loss_coef': 0.24856399230654172, 'gfl_gamma': 2.8647289227395274, 'use_agc': False, 'num_linear_experts': 1, 'num_univariate_esn_experts': 4, 'num_multivariate_esn_experts': 8, 'k': 11, 'hidden_size': 128, 'reservoir_size_uni': 16, 'spectral_radius_uni': 1.15575392434893, 'sparsity_uni': 0.4229579315307963, 'leak_rate_uni': 0.9459946582403866, 'input_scaling_uni': 0.22775061197103993, 'esn_uni_weight_decay': 0.01755117395947925, 'reservoir_size_multi': 16, 'spectral_radius_multi': 0.8059150284591196, 'sparsity_multi': 0.24403934044535086, 'leak_rate_multi': 0.6130858113204891, 'input_scaling_multi': 0.25574588346347443, 'esn_multi_weight_decay': 0.0009002864316753714, 'projection_head_layers': 3, 'projection_head_dim_factor': 1, 'projection_head_dropout': 0.37690730987127025, 'loss_target_clip': None, 'jerk_loss_coef': 0.0015801699694725285, 'use_channel_adjacency_prior': True}. Best is trial 1 with value: 2.7493555545806885.
[I 2025-07-27 20:04:33,260] Trial 60 finished with value: 3.1332058906555176 and parameters: {'seq_len': 96, 'norm_mode': 'subtract_median', 'lr': 0.009115810329694666, 'd_model': 512, 'd_ff': 512, 'e_layers': 3, 'moving_avg': 49, 'n_heads': 2, 'dropout': 0.3982164252956714, 'fc_dropout': 0.20910151536537966, 'batch_size': 1024, 'loss_coef': 0.10666164190743271, 'gfl_gamma': 2.8434376348785237, 'use_agc': False, 'num_linear_experts': 1, 'num_univariate_esn_experts': 4, 'num_multivariate_esn_experts': 8, 'k': 6, 'hidden_size': 128, 'reservoir_size_uni': 16, 'spectral_radius_uni': 1.1791738513543248, 'sparsity_uni': 0.44227625534781784, 'leak_rate_uni': 0.8956530549347343, 'input_scaling_uni': 0.1190719261404492, 'esn_uni_weight_decay': 0.01102297744619205, 'reservoir_size_multi': 16, 'spectral_radius_multi': 0.7854225103015953, 'sparsity_multi': 0.3459332578795781, 'leak_rate_multi': 0.6296972678217533, 'input_scaling_multi': 0.2790475372111648, 'esn_multi_weight_decay': 0.0009373618903616265, 'projection_head_layers': 3, 'projection_head_dim_factor': 1, 'projection_head_dropout': 0.400882789849516, 'loss_target_clip': 15.0, 'jerk_loss_coef': 0.00549135995056016, 'use_channel_adjacency_prior': True}. Best is trial 1 with value: 2.7493555545806885.
