[I 2025-07-27 20:07:41,921] Trial 55 pruned. 
[I 2025-07-27 20:24:39,348] A new study created in RDB with name: eisbach_pure_test
[I 2025-07-27 20:24:39,349] Using an existing study with name 'eisbach_pure_test' instead of creating a new one.
[I 2025-07-27 20:24:39,349] Using an existing study with name 'eisbach_pure_test' instead of creating a new one.
[I 2025-07-27 20:24:39,350] Using an existing study with name 'eisbach_pure_test' instead of creating a new one.
[I 2025-07-27 20:24:39,359] Using an existing study with name 'eisbach_pure_test' instead of creating a new one.
[I 2025-07-27 20:24:39,374] Using an existing study with name 'eisbach_pure_test' instead of creating a new one.
[I 2025-07-27 20:24:39,394] Using an existing study with name 'eisbach_pure_test' instead of creating a new one.
[I 2025-07-27 20:24:39,420] Using an existing study with name 'eisbach_pure_test' instead of creating a new one.
[I 2025-07-27 20:24:39,560] Trial with params {'seq_len': 48, 'norm_mode': 'subtract_median', 'lr': 0.0008605360326555651, 'd_model': 512, 'd_ff': 128, 'e_layers': 2, 'moving_avg': 97, 'n_heads': 2, 'dropout': 0.08354823354484386, 'fc_dropout': 0.10203105653571898, 'batch_size': 128, 'loss_coef': 0.187904496840974, 'gfl_gamma': 2.738703335776763, 'use_agc': True, 'agc_lambda': 0.00756937624402596, 'num_linear_experts': 4, 'num_univariate_esn_experts': 5, 'num_multivariate_esn_experts': 2, 'k': 10, 'hidden_size': 512, 'reservoir_size_uni': 64, 'spectral_radius_uni': 0.8524029915859183, 'sparsity_uni': 0.35752443217997315, 'leak_rate_uni': 0.6887125029280805, 'input_scaling_uni': 0.3868161172348993, 'esn_uni_weight_decay': 0.010231553172756288, 'reservoir_size_multi': 32, 'spectral_radius_multi': 0.7115061204325002, 'sparsity_multi': 0.30237269525978594, 'leak_rate_multi': 0.6016088987086231, 'input_scaling_multi': 0.4479674582849533, 'esn_multi_weight_decay': 5.3831988922890375e-05, 'projection_head_layers': 4, 'projection_head_dim_factor': 4, 'projection_head_dropout': 0.15243404207423233, 'loss_target_clip': 5.0, 'jerk_loss_coef': 0.0004761452033727859, 'use_channel_adjacency_prior': False} already exists. Skipping enqueue.
[I 2025-07-27 20:24:39,560] Trial with params {'seq_len': 48, 'norm_mode': 'subtract_median', 'lr': 0.0008605360326555651, 'd_model': 512, 'd_ff': 128, 'e_layers': 2, 'moving_avg': 97, 'n_heads': 2, 'dropout': 0.08354823354484386, 'fc_dropout': 0.10203105653571898, 'batch_size': 128, 'loss_coef': 0.187904496840974, 'gfl_gamma': 2.738703335776763, 'use_agc': True, 'agc_lambda': 0.00756937624402596, 'num_linear_experts': 4, 'num_univariate_esn_experts': 5, 'num_multivariate_esn_experts': 2, 'k': 10, 'hidden_size': 512, 'reservoir_size_uni': 64, 'spectral_radius_uni': 0.8524029915859183, 'sparsity_uni': 0.35752443217997315, 'leak_rate_uni': 0.6887125029280805, 'input_scaling_uni': 0.3868161172348993, 'esn_uni_weight_decay': 0.010231553172756288, 'reservoir_size_multi': 32, 'spectral_radius_multi': 0.7115061204325002, 'sparsity_multi': 0.30237269525978594, 'leak_rate_multi': 0.6016088987086231, 'input_scaling_multi': 0.4479674582849533, 'esn_multi_weight_decay': 5.3831988922890375e-05, 'projection_head_layers': 4, 'projection_head_dim_factor': 4, 'projection_head_dropout': 0.15243404207423233, 'loss_target_clip': 5.0, 'jerk_loss_coef': 0.0004761452033727859, 'use_channel_adjacency_prior': False} already exists. Skipping enqueue.
[I 2025-07-27 20:24:39,580] Trial with params {'seq_len': 48, 'norm_mode': 'subtract_median', 'lr': 0.0008605360326555651, 'd_model': 512, 'd_ff': 128, 'e_layers': 2, 'moving_avg': 97, 'n_heads': 2, 'dropout': 0.08354823354484386, 'fc_dropout': 0.10203105653571898, 'batch_size': 128, 'loss_coef': 0.187904496840974, 'gfl_gamma': 2.738703335776763, 'use_agc': True, 'agc_lambda': 0.00756937624402596, 'num_linear_experts': 4, 'num_univariate_esn_experts': 5, 'num_multivariate_esn_experts': 2, 'k': 10, 'hidden_size': 512, 'reservoir_size_uni': 64, 'spectral_radius_uni': 0.8524029915859183, 'sparsity_uni': 0.35752443217997315, 'leak_rate_uni': 0.6887125029280805, 'input_scaling_uni': 0.3868161172348993, 'esn_uni_weight_decay': 0.010231553172756288, 'reservoir_size_multi': 32, 'spectral_radius_multi': 0.7115061204325002, 'sparsity_multi': 0.30237269525978594, 'leak_rate_multi': 0.6016088987086231, 'input_scaling_multi': 0.4479674582849533, 'esn_multi_weight_decay': 5.3831988922890375e-05, 'projection_head_layers': 4, 'projection_head_dim_factor': 4, 'projection_head_dropout': 0.15243404207423233, 'loss_target_clip': 5.0, 'jerk_loss_coef': 0.0004761452033727859, 'use_channel_adjacency_prior': False} already exists. Skipping enqueue.
[I 2025-07-27 20:24:39,591] Trial with params {'seq_len': 48, 'norm_mode': 'subtract_median', 'lr': 0.0017159192475524516, 'd_model': 512, 'd_ff': 128, 'e_layers': 2, 'moving_avg': 97, 'n_heads': 8, 'dropout': 0.040917288215277445, 'fc_dropout': 0.123648606852257, 'batch_size': 256, 'loss_coef': 0.19555558452776486, 'gfl_gamma': 3.879013910356247, 'use_agc': True, 'agc_lambda': 0.015336359166606996, 'num_linear_experts': 7, 'num_univariate_esn_experts': 4, 'num_multivariate_esn_experts': 1, 'k': 10, 'hidden_size': 512, 'reservoir_size_uni': 256, 'spectral_radius_uni': 0.7073117735185094, 'sparsity_uni': 0.3133939729319679, 'leak_rate_uni': 0.6029081875021126, 'input_scaling_uni': 0.22043533691904282, 'esn_uni_weight_decay': 3.266839670615327e-06, 'reservoir_size_multi': 16, 'spectral_radius_multi': 0.838106364244102, 'sparsity_multi': 0.29129247862824276, 'leak_rate_multi': 0.5627518919040384, 'input_scaling_multi': 0.7029850102824757, 'esn_multi_weight_decay': 7.25662086710575e-05, 'projection_head_layers': 4, 'projection_head_dim_factor': 4, 'projection_head_dropout': 0.11144880342319746, 'loss_target_clip': 5.0, 'jerk_loss_coef': 0.009482376628380444, 'use_channel_adjacency_prior': False} already exists. Skipping enqueue.
[I 2025-07-27 20:24:39,591] Trial with params {'seq_len': 48, 'norm_mode': 'subtract_median', 'lr': 0.0017159192475524516, 'd_model': 512, 'd_ff': 128, 'e_layers': 2, 'moving_avg': 97, 'n_heads': 8, 'dropout': 0.040917288215277445, 'fc_dropout': 0.123648606852257, 'batch_size': 256, 'loss_coef': 0.19555558452776486, 'gfl_gamma': 3.879013910356247, 'use_agc': True, 'agc_lambda': 0.015336359166606996, 'num_linear_experts': 7, 'num_univariate_esn_experts': 4, 'num_multivariate_esn_experts': 1, 'k': 10, 'hidden_size': 512, 'reservoir_size_uni': 256, 'spectral_radius_uni': 0.7073117735185094, 'sparsity_uni': 0.3133939729319679, 'leak_rate_uni': 0.6029081875021126, 'input_scaling_uni': 0.22043533691904282, 'esn_uni_weight_decay': 3.266839670615327e-06, 'reservoir_size_multi': 16, 'spectral_radius_multi': 0.838106364244102, 'sparsity_multi': 0.29129247862824276, 'leak_rate_multi': 0.5627518919040384, 'input_scaling_multi': 0.7029850102824757, 'esn_multi_weight_decay': 7.25662086710575e-05, 'projection_head_layers': 4, 'projection_head_dim_factor': 4, 'projection_head_dropout': 0.11144880342319746, 'loss_target_clip': 5.0, 'jerk_loss_coef': 0.009482376628380444, 'use_channel_adjacency_prior': False} already exists. Skipping enqueue.
[I 2025-07-27 20:24:39,592] Trial with params {'seq_len': 48, 'norm_mode': 'subtract_median', 'lr': 0.0008605360326555651, 'd_model': 512, 'd_ff': 128, 'e_layers': 2, 'moving_avg': 97, 'n_heads': 2, 'dropout': 0.08354823354484386, 'fc_dropout': 0.10203105653571898, 'batch_size': 128, 'loss_coef': 0.187904496840974, 'gfl_gamma': 2.738703335776763, 'use_agc': True, 'agc_lambda': 0.00756937624402596, 'num_linear_experts': 4, 'num_univariate_esn_experts': 5, 'num_multivariate_esn_experts': 2, 'k': 10, 'hidden_size': 512, 'reservoir_size_uni': 64, 'spectral_radius_uni': 0.8524029915859183, 'sparsity_uni': 0.35752443217997315, 'leak_rate_uni': 0.6887125029280805, 'input_scaling_uni': 0.3868161172348993, 'esn_uni_weight_decay': 0.010231553172756288, 'reservoir_size_multi': 32, 'spectral_radius_multi': 0.7115061204325002, 'sparsity_multi': 0.30237269525978594, 'leak_rate_multi': 0.6016088987086231, 'input_scaling_multi': 0.4479674582849533, 'esn_multi_weight_decay': 5.3831988922890375e-05, 'projection_head_layers': 4, 'projection_head_dim_factor': 4, 'projection_head_dropout': 0.15243404207423233, 'loss_target_clip': 5.0, 'jerk_loss_coef': 0.0004761452033727859, 'use_channel_adjacency_prior': False} already exists. Skipping enqueue.
[I 2025-07-27 20:24:39,597] Trial with params {'seq_len': 48, 'norm_mode': 'subtract_median', 'lr': 0.0008605360326555651, 'd_model': 512, 'd_ff': 128, 'e_layers': 2, 'moving_avg': 97, 'n_heads': 2, 'dropout': 0.08354823354484386, 'fc_dropout': 0.10203105653571898, 'batch_size': 128, 'loss_coef': 0.187904496840974, 'gfl_gamma': 2.738703335776763, 'use_agc': True, 'agc_lambda': 0.00756937624402596, 'num_linear_experts': 4, 'num_univariate_esn_experts': 5, 'num_multivariate_esn_experts': 2, 'k': 10, 'hidden_size': 512, 'reservoir_size_uni': 64, 'spectral_radius_uni': 0.8524029915859183, 'sparsity_uni': 0.35752443217997315, 'leak_rate_uni': 0.6887125029280805, 'input_scaling_uni': 0.3868161172348993, 'esn_uni_weight_decay': 0.010231553172756288, 'reservoir_size_multi': 32, 'spectral_radius_multi': 0.7115061204325002, 'sparsity_multi': 0.30237269525978594, 'leak_rate_multi': 0.6016088987086231, 'input_scaling_multi': 0.4479674582849533, 'esn_multi_weight_decay': 5.3831988922890375e-05, 'projection_head_layers': 4, 'projection_head_dim_factor': 4, 'projection_head_dropout': 0.15243404207423233, 'loss_target_clip': 5.0, 'jerk_loss_coef': 0.0004761452033727859, 'use_channel_adjacency_prior': False} already exists. Skipping enqueue.
[I 2025-07-27 20:24:39,599] Trial with params {'seq_len': 48, 'norm_mode': 'subtract_median', 'lr': 0.0018682728931823482, 'd_model': 512, 'd_ff': 128, 'e_layers': 2, 'moving_avg': 97, 'n_heads': 1, 'dropout': 0.031081897252458534, 'fc_dropout': 0.1246378948471369, 'batch_size': 256, 'loss_coef': 0.16622273582274275, 'gfl_gamma': 3.7640394141744316, 'use_agc': True, 'agc_lambda': 0.008136639708640373, 'num_linear_experts': 4, 'num_univariate_esn_experts': 4, 'num_multivariate_esn_experts': 2, 'k': 9, 'hidden_size': 512, 'reservoir_size_uni': 256, 'spectral_radius_uni': 0.6869488256239484, 'sparsity_uni': 0.2252184746901049, 'leak_rate_uni': 0.5985872805261063, 'input_scaling_uni': 0.332367613647569, 'esn_uni_weight_decay': 2.3986920238131313e-06, 'reservoir_size_multi': 256, 'spectral_radius_multi': 0.8347947063615707, 'sparsity_multi': 0.2829305364954448, 'leak_rate_multi': 0.5483857412969081, 'input_scaling_multi': 0.46484669921024097, 'esn_multi_weight_decay': 4.71767213085866e-05, 'projection_head_layers': 4, 'projection_head_dim_factor': 4, 'projection_head_dropout': 0.043169365493366925, 'loss_target_clip': 5.0, 'jerk_loss_coef': 0.00662727474011457, 'use_channel_adjacency_prior': False} already exists. Skipping enqueue.
[I 2025-07-27 20:24:39,599] Trial with params {'seq_len': 48, 'norm_mode': 'subtract_median', 'lr': 0.0018682728931823482, 'd_model': 512, 'd_ff': 128, 'e_layers': 2, 'moving_avg': 97, 'n_heads': 1, 'dropout': 0.031081897252458534, 'fc_dropout': 0.1246378948471369, 'batch_size': 256, 'loss_coef': 0.16622273582274275, 'gfl_gamma': 3.7640394141744316, 'use_agc': True, 'agc_lambda': 0.008136639708640373, 'num_linear_experts': 4, 'num_univariate_esn_experts': 4, 'num_multivariate_esn_experts': 2, 'k': 9, 'hidden_size': 512, 'reservoir_size_uni': 256, 'spectral_radius_uni': 0.6869488256239484, 'sparsity_uni': 0.2252184746901049, 'leak_rate_uni': 0.5985872805261063, 'input_scaling_uni': 0.332367613647569, 'esn_uni_weight_decay': 2.3986920238131313e-06, 'reservoir_size_multi': 256, 'spectral_radius_multi': 0.8347947063615707, 'sparsity_multi': 0.2829305364954448, 'leak_rate_multi': 0.5483857412969081, 'input_scaling_multi': 0.46484669921024097, 'esn_multi_weight_decay': 4.71767213085866e-05, 'projection_head_layers': 4, 'projection_head_dim_factor': 4, 'projection_head_dropout': 0.043169365493366925, 'loss_target_clip': 5.0, 'jerk_loss_coef': 0.00662727474011457, 'use_channel_adjacency_prior': False} already exists. Skipping enqueue.
[I 2025-07-27 20:24:39,599] Trial with params {'seq_len': 48, 'norm_mode': 'subtract_median', 'lr': 0.0017159192475524516, 'd_model': 512, 'd_ff': 128, 'e_layers': 2, 'moving_avg': 97, 'n_heads': 8, 'dropout': 0.040917288215277445, 'fc_dropout': 0.123648606852257, 'batch_size': 256, 'loss_coef': 0.19555558452776486, 'gfl_gamma': 3.879013910356247, 'use_agc': True, 'agc_lambda': 0.015336359166606996, 'num_linear_experts': 7, 'num_univariate_esn_experts': 4, 'num_multivariate_esn_experts': 1, 'k': 10, 'hidden_size': 512, 'reservoir_size_uni': 256, 'spectral_radius_uni': 0.7073117735185094, 'sparsity_uni': 0.3133939729319679, 'leak_rate_uni': 0.6029081875021126, 'input_scaling_uni': 0.22043533691904282, 'esn_uni_weight_decay': 3.266839670615327e-06, 'reservoir_size_multi': 16, 'spectral_radius_multi': 0.838106364244102, 'sparsity_multi': 0.29129247862824276, 'leak_rate_multi': 0.5627518919040384, 'input_scaling_multi': 0.7029850102824757, 'esn_multi_weight_decay': 7.25662086710575e-05, 'projection_head_layers': 4, 'projection_head_dim_factor': 4, 'projection_head_dropout': 0.11144880342319746, 'loss_target_clip': 5.0, 'jerk_loss_coef': 0.009482376628380444, 'use_channel_adjacency_prior': False} already exists. Skipping enqueue.
[I 2025-07-27 20:24:39,600] Trial with params {'seq_len': 48, 'norm_mode': 'subtract_median', 'lr': 0.0017159192475524516, 'd_model': 512, 'd_ff': 128, 'e_layers': 2, 'moving_avg': 97, 'n_heads': 8, 'dropout': 0.040917288215277445, 'fc_dropout': 0.123648606852257, 'batch_size': 256, 'loss_coef': 0.19555558452776486, 'gfl_gamma': 3.879013910356247, 'use_agc': True, 'agc_lambda': 0.015336359166606996, 'num_linear_experts': 7, 'num_univariate_esn_experts': 4, 'num_multivariate_esn_experts': 1, 'k': 10, 'hidden_size': 512, 'reservoir_size_uni': 256, 'spectral_radius_uni': 0.7073117735185094, 'sparsity_uni': 0.3133939729319679, 'leak_rate_uni': 0.6029081875021126, 'input_scaling_uni': 0.22043533691904282, 'esn_uni_weight_decay': 3.266839670615327e-06, 'reservoir_size_multi': 16, 'spectral_radius_multi': 0.838106364244102, 'sparsity_multi': 0.29129247862824276, 'leak_rate_multi': 0.5627518919040384, 'input_scaling_multi': 0.7029850102824757, 'esn_multi_weight_decay': 7.25662086710575e-05, 'projection_head_layers': 4, 'projection_head_dim_factor': 4, 'projection_head_dropout': 0.11144880342319746, 'loss_target_clip': 5.0, 'jerk_loss_coef': 0.009482376628380444, 'use_channel_adjacency_prior': False} already exists. Skipping enqueue.
[I 2025-07-27 20:24:39,602] Trial with params {'seq_len': 96, 'norm_mode': 'subtract_median', 'lr': 0.007634543984860757, 'd_model': 512, 'd_ff': 512, 'e_layers': 3, 'moving_avg': 49, 'n_heads': 2, 'dropout': 0.4181159394885853, 'fc_dropout': 0.2241914651090713, 'batch_size': 1024, 'loss_coef': 0.17079658142285847, 'gfl_gamma': 3.3821925647999342, 'use_agc': False, 'num_linear_experts': 2, 'num_univariate_esn_experts': 4, 'num_multivariate_esn_experts': 8, 'k': 6, 'hidden_size': 128, 'reservoir_size_uni': 16, 'spectral_radius_uni': 1.157704023403662, 'sparsity_uni': 0.4627077313755891, 'leak_rate_uni': 0.8773773373005375, 'input_scaling_uni': 0.22733823262615188, 'esn_uni_weight_decay': 0.012039163925678407, 'reservoir_size_multi': 16, 'spectral_radius_multi': 0.7699925451872774, 'sparsity_multi': 0.353027841739084, 'leak_rate_multi': 0.65058369895222, 'input_scaling_multi': 0.24066961159786396, 'esn_multi_weight_decay': 0.0014010630594118998, 'projection_head_layers': 3, 'projection_head_dim_factor': 1, 'projection_head_dropout': 0.33699775331795906, 'loss_target_clip': None, 'jerk_loss_coef': 0.18080202001548082, 'use_channel_adjacency_prior': True} already exists. Skipping enqueue.
[I 2025-07-27 20:24:39,606] Trial with params {'seq_len': 96, 'norm_mode': 'subtract_median', 'lr': 0.007634543984860757, 'd_model': 512, 'd_ff': 512, 'e_layers': 3, 'moving_avg': 49, 'n_heads': 2, 'dropout': 0.4181159394885853, 'fc_dropout': 0.2241914651090713, 'batch_size': 1024, 'loss_coef': 0.17079658142285847, 'gfl_gamma': 3.3821925647999342, 'use_agc': False, 'num_linear_experts': 2, 'num_univariate_esn_experts': 4, 'num_multivariate_esn_experts': 8, 'k': 6, 'hidden_size': 128, 'reservoir_size_uni': 16, 'spectral_radius_uni': 1.157704023403662, 'sparsity_uni': 0.4627077313755891, 'leak_rate_uni': 0.8773773373005375, 'input_scaling_uni': 0.22733823262615188, 'esn_uni_weight_decay': 0.012039163925678407, 'reservoir_size_multi': 16, 'spectral_radius_multi': 0.7699925451872774, 'sparsity_multi': 0.353027841739084, 'leak_rate_multi': 0.65058369895222, 'input_scaling_multi': 0.24066961159786396, 'esn_multi_weight_decay': 0.0014010630594118998, 'projection_head_layers': 3, 'projection_head_dim_factor': 1, 'projection_head_dropout': 0.33699775331795906, 'loss_target_clip': None, 'jerk_loss_coef': 0.18080202001548082, 'use_channel_adjacency_prior': True} already exists. Skipping enqueue.
[I 2025-07-27 20:24:39,607] Trial with params {'seq_len': 48, 'norm_mode': 'subtract_median', 'lr': 0.0018682728931823482, 'd_model': 512, 'd_ff': 128, 'e_layers': 2, 'moving_avg': 97, 'n_heads': 1, 'dropout': 0.031081897252458534, 'fc_dropout': 0.1246378948471369, 'batch_size': 256, 'loss_coef': 0.16622273582274275, 'gfl_gamma': 3.7640394141744316, 'use_agc': True, 'agc_lambda': 0.008136639708640373, 'num_linear_experts': 4, 'num_univariate_esn_experts': 4, 'num_multivariate_esn_experts': 2, 'k': 9, 'hidden_size': 512, 'reservoir_size_uni': 256, 'spectral_radius_uni': 0.6869488256239484, 'sparsity_uni': 0.2252184746901049, 'leak_rate_uni': 0.5985872805261063, 'input_scaling_uni': 0.332367613647569, 'esn_uni_weight_decay': 2.3986920238131313e-06, 'reservoir_size_multi': 256, 'spectral_radius_multi': 0.8347947063615707, 'sparsity_multi': 0.2829305364954448, 'leak_rate_multi': 0.5483857412969081, 'input_scaling_multi': 0.46484669921024097, 'esn_multi_weight_decay': 4.71767213085866e-05, 'projection_head_layers': 4, 'projection_head_dim_factor': 4, 'projection_head_dropout': 0.043169365493366925, 'loss_target_clip': 5.0, 'jerk_loss_coef': 0.00662727474011457, 'use_channel_adjacency_prior': False} already exists. Skipping enqueue.
[I 2025-07-27 20:24:39,609] Trial with params {'seq_len': 48, 'norm_mode': 'subtract_median', 'lr': 0.0018682728931823482, 'd_model': 512, 'd_ff': 128, 'e_layers': 2, 'moving_avg': 97, 'n_heads': 1, 'dropout': 0.031081897252458534, 'fc_dropout': 0.1246378948471369, 'batch_size': 256, 'loss_coef': 0.16622273582274275, 'gfl_gamma': 3.7640394141744316, 'use_agc': True, 'agc_lambda': 0.008136639708640373, 'num_linear_experts': 4, 'num_univariate_esn_experts': 4, 'num_multivariate_esn_experts': 2, 'k': 9, 'hidden_size': 512, 'reservoir_size_uni': 256, 'spectral_radius_uni': 0.6869488256239484, 'sparsity_uni': 0.2252184746901049, 'leak_rate_uni': 0.5985872805261063, 'input_scaling_uni': 0.332367613647569, 'esn_uni_weight_decay': 2.3986920238131313e-06, 'reservoir_size_multi': 256, 'spectral_radius_multi': 0.8347947063615707, 'sparsity_multi': 0.2829305364954448, 'leak_rate_multi': 0.5483857412969081, 'input_scaling_multi': 0.46484669921024097, 'esn_multi_weight_decay': 4.71767213085866e-05, 'projection_head_layers': 4, 'projection_head_dim_factor': 4, 'projection_head_dropout': 0.043169365493366925, 'loss_target_clip': 5.0, 'jerk_loss_coef': 0.00662727474011457, 'use_channel_adjacency_prior': False} already exists. Skipping enqueue.
[I 2025-07-27 20:24:39,619] Trial with params {'seq_len': 48, 'norm_mode': 'subtract_median', 'lr': 0.0017159192475524516, 'd_model': 512, 'd_ff': 128, 'e_layers': 2, 'moving_avg': 97, 'n_heads': 8, 'dropout': 0.040917288215277445, 'fc_dropout': 0.123648606852257, 'batch_size': 256, 'loss_coef': 0.19555558452776486, 'gfl_gamma': 3.879013910356247, 'use_agc': True, 'agc_lambda': 0.015336359166606996, 'num_linear_experts': 7, 'num_univariate_esn_experts': 4, 'num_multivariate_esn_experts': 1, 'k': 10, 'hidden_size': 512, 'reservoir_size_uni': 256, 'spectral_radius_uni': 0.7073117735185094, 'sparsity_uni': 0.3133939729319679, 'leak_rate_uni': 0.6029081875021126, 'input_scaling_uni': 0.22043533691904282, 'esn_uni_weight_decay': 3.266839670615327e-06, 'reservoir_size_multi': 16, 'spectral_radius_multi': 0.838106364244102, 'sparsity_multi': 0.29129247862824276, 'leak_rate_multi': 0.5627518919040384, 'input_scaling_multi': 0.7029850102824757, 'esn_multi_weight_decay': 7.25662086710575e-05, 'projection_head_layers': 4, 'projection_head_dim_factor': 4, 'projection_head_dropout': 0.11144880342319746, 'loss_target_clip': 5.0, 'jerk_loss_coef': 0.009482376628380444, 'use_channel_adjacency_prior': False} already exists. Skipping enqueue.
[I 2025-07-27 20:24:39,619] Trial with params {'seq_len': 96, 'norm_mode': 'subtract_median', 'lr': 0.007634543984860757, 'd_model': 512, 'd_ff': 512, 'e_layers': 3, 'moving_avg': 49, 'n_heads': 2, 'dropout': 0.4181159394885853, 'fc_dropout': 0.2241914651090713, 'batch_size': 1024, 'loss_coef': 0.17079658142285847, 'gfl_gamma': 3.3821925647999342, 'use_agc': False, 'num_linear_experts': 2, 'num_univariate_esn_experts': 4, 'num_multivariate_esn_experts': 8, 'k': 6, 'hidden_size': 128, 'reservoir_size_uni': 16, 'spectral_radius_uni': 1.157704023403662, 'sparsity_uni': 0.4627077313755891, 'leak_rate_uni': 0.8773773373005375, 'input_scaling_uni': 0.22733823262615188, 'esn_uni_weight_decay': 0.012039163925678407, 'reservoir_size_multi': 16, 'spectral_radius_multi': 0.7699925451872774, 'sparsity_multi': 0.353027841739084, 'leak_rate_multi': 0.65058369895222, 'input_scaling_multi': 0.24066961159786396, 'esn_multi_weight_decay': 0.0014010630594118998, 'projection_head_layers': 3, 'projection_head_dim_factor': 1, 'projection_head_dropout': 0.33699775331795906, 'loss_target_clip': None, 'jerk_loss_coef': 0.18080202001548082, 'use_channel_adjacency_prior': True} already exists. Skipping enqueue.
[I 2025-07-27 20:24:39,623] T