[I 2025-07-27 20:41:59,706] Trial 0 pruned. 
[I 2025-07-27 20:45:39,103] Trial 7 pruned. 
[I 2025-07-27 20:47:24,206] Trial 2 pruned. 
[I 2025-07-27 20:52:40,355] Trial 1 finished with value: 2.7920470237731934 and parameters: {'seq_len': 48, 'norm_mode': 'subtract_median', 'lr': 0.0017159192475524516, 'd_model': 512, 'd_ff': 128, 'e_layers': 2, 'moving_avg': 97, 'n_heads': 8, 'dropout': 0.040917288215277445, 'fc_dropout': 0.123648606852257, 'batch_size': 256, 'loss_coef': 0.19555558452776486, 'loss_function': 'gfl', 'gfl_gamma': 3.879013910356247, 'use_agc': True, 'agc_lambda': 0.015336359166606996, 'num_linear_experts': 7, 'num_univariate_esn_experts': 4, 'num_multivariate_esn_experts': 1, 'k': 10, 'hidden_size': 512, 'reservoir_size_uni': 256, 'spectral_radius_uni': 0.7073117735185094, 'sparsity_uni': 0.3133939729319679, 'leak_rate_uni': 0.6029081875021126, 'input_scaling_uni': 0.22043533691904282, 'esn_uni_weight_decay': 3.266839670615327e-06, 'reservoir_size_multi': 16, 'spectral_radius_multi': 0.838106364244102, 'sparsity_multi': 0.29129247862824276, 'leak_rate_multi': 0.5627518919040384, 'input_scaling_multi': 0.7029850102824757, 'esn_multi_weight_decay': 7.25662086710575e-05, 'projection_head_layers': 4, 'projection_head_dim_factor': 4, 'projection_head_dropout': 0.11144880342319746, 'loss_target_clip': 5.0, 'jerk_loss_coef': 0.009482376628380444, 'use_channel_adjacency_prior': False}. Best is trial 1 with value: 2.7920470237731934.
[I 2025-07-27 20:52:56,324] Trial 4 finished with value: 2.652780532836914 and parameters: {'seq_len': 48, 'norm_mode': 'subtract_median', 'lr': 0.0018682728931823482, 'd_model': 512, 'd_ff': 128, 'e_layers': 2, 'moving_avg': 97, 'n_heads': 1, 'dropout': 0.031081897252458534, 'fc_dropout': 0.1246378948471369, 'batch_size': 256, 'loss_coef': 0.16622273582274275, 'loss_function': 'crps', 'use_agc': True, 'agc_lambda': 0.008136639708640373, 'num_linear_experts': 4, 'num_univariate_esn_experts': 4, 'num_multivariate_esn_experts': 2, 'k': 9, 'hidden_size': 512, 'reservoir_size_uni': 256, 'spectral_radius_uni': 0.6869488256239484, 'sparsity_uni': 0.2252184746901049, 'leak_rate_uni': 0.5985872805261063, 'input_scaling_uni': 0.332367613647569, 'esn_uni_weight_decay': 2.3986920238131313e-06, 'reservoir_size_multi': 256, 'spectral_radius_multi': 0.8347947063615707, 'sparsity_multi': 0.2829305364954448, 'leak_rate_multi': 0.5483857412969081, 'input_scaling_multi': 0.46484669921024097, 'esn_multi_weight_decay': 4.71767213085866e-05, 'projection_head_layers': 4, 'projection_head_dim_factor': 4, 'projection_head_dropout': 0.043169365493366925, 'loss_target_clip': 5.0, 'jerk_loss_coef': 0.00662727474011457, 'use_channel_adjacency_prior': False}. Best is trial 4 with value: 2.652780532836914.
[I 2025-07-27 20:53:09,116] Trial 6 finished with value: 2.4769127368927 and parameters: {'seq_len': 48, 'norm_mode': 'subtract_median', 'lr': 0.0008605360326555651, 'd_model': 512, 'd_ff': 128, 'e_layers': 2, 'moving_avg': 97, 'n_heads': 2, 'dropout': 0.08354823354484386, 'fc_dropout': 0.10203105653571898, 'batch_size': 128, 'loss_coef': 0.187904496840974, 'loss_function': 'crps', 'use_agc': True, 'agc_lambda': 0.00756937624402596, 'num_linear_experts': 4, 'num_univariate_esn_experts': 5, 'num_multivariate_esn_experts': 2, 'k': 10, 'hidden_size': 512, 'reservoir_size_uni': 64, 'spectral_radius_uni': 0.8524029915859183, 'sparsity_uni': 0.35752443217997315, 'leak_rate_uni': 0.6887125029280805, 'input_scaling_uni': 0.3868161172348993, 'esn_uni_weight_decay': 0.010231553172756288, 'reservoir_size_multi': 32, 'spectral_radius_multi': 0.7115061204325002, 'sparsity_multi': 0.30237269525978594, 'leak_rate_multi': 0.6016088987086231, 'input_scaling_multi': 0.4479674582849533, 'esn_multi_weight_decay': 5.3831988922890375e-05, 'projection_head_layers': 4, 'projection_head_dim_factor': 4, 'projection_head_dropout': 0.15243404207423233, 'loss_target_clip': 5.0, 'jerk_loss_coef': 0.0004761452033727859, 'use_channel_adjacency_prior': False}. Best is trial 6 with value: 2.4769127368927.
[I 2025-07-27 20:57:35,953] Trial 9 finished with value: 26.1640625 and parameters: {'seq_len': 192, 'norm_mode': 'subtract_last', 'lr': 1.225927742820288e-06, 'd_model': 256, 'd_ff': 32, 'e_layers': 1, 'moving_avg': 5, 'n_heads': 2, 'dropout': 0.35130948627140557, 'fc_dropout': 0.07593217958499508, 'batch_size': 512, 'loss_coef': 0.36579717543261486, 'loss_function': 'crps', 'use_agc': True, 'agc_lambda': 0.07395458870898855, 'num_linear_experts': 8, 'num_univariate_esn_experts': 0, 'num_multivariate_esn_experts': 0, 'k': 1, 'hidden_size': 32, 'projection_head_layers': 1, 'projection_head_dim_factor': 8, 'projection_head_dropout': 0.17597813214508948, 'loss_target_clip': 15.0, 'jerk_loss_coef': 0.00044348940228011236, 'use_channel_adjacency_prior': False}. Best is trial 6 with value: 2.4769127368927.
[I 2025-07-27 21:01:06,114] Trial 8 finished with value: 24.632291793823242 and parameters: {'seq_len': 192, 'norm_mode': 'subtract_last', 'lr': 1.225927742820288e-06, 'd_model': 256, 'd_ff': 32, 'e_layers': 1, 'moving_avg': 5, 'n_heads': 2, 'dropout': 0.35130948627140557, 'fc_dropout': 0.07593217958499508, 'batch_size': 512, 'loss_coef': 0.36579717543261486, 'loss_function': 'crps', 'use_agc': True, 'agc_lambda': 0.07395458870898855, 'num_linear_experts': 8, 'num_univariate_esn_experts': 0, 'num_multivariate_esn_experts': 0, 'k': 1, 'hidden_size': 32, 'projection_head_layers': 1, 'projection_head_dim_factor': 8, 'projection_head_dropout': 0.17597813214508948, 'loss_target_clip': 15.0, 'jerk_loss_coef': 0.00044348940228011236, 'use_channel_adjacency_prior': False}. Best is trial 6 with value: 2.4769127368927.
[I 2025-07-27 21:05:20,207] Trial 13 pruned. 
[I 2025-07-27 21:05:21,113] Trial 10 pruned. 
[I 2025-07-27 21:09:48,712] Trial 15 pruned. 
[I 2025-07-27 21:12:06,828] Trial 3 finished with value: 2.478060483932495 and parameters: {'seq_len': 48, 'norm_mode': 'subtract_median', 'lr': 0.0008605360326555651, 'd_model': 512, 'd_ff': 128, 'e_layers': 2, 'moving_avg': 97, 'n_heads': 2, 'dropout': 0.08354823354484386, 'fc_dropout': 0.10203105653571898, 'batch_size': 128, 'loss_coef': 0.187904496840974, 'loss_function': 'crps', 'use_agc': True, 'agc_lambda': 0.00756937624402596, 'num_linear_experts': 4, 'num_univariate_esn_experts': 5, 'num_multivariate_esn_experts': 2, 'k': 10, 'hidden_size': 512, 'reservoir_size_uni': 64, 'spectral_radius_uni': 0.8524029915859183, 'sparsity_uni': 0.35752443217997315, 'leak_rate_uni': 0.6887125029280805, 'input_scaling_uni': 0.3868161172348993, 'esn_uni_weight_decay': 0.010231553172756288, 'reservoir_size_multi': 32, 'spectral_radius_multi': 0.7115061204325002, 'sparsity_multi': 0.30237269525978594, 'leak_rate_multi': 0.6016088987086231, 'input_scaling_multi': 0.4479674582849533, 'esn_multi_weight_decay': 5.3831988922890375e-05, 'projection_head_layers': 4, 'projection_head_dim_factor': 4, 'projection_head_dropout': 0.15243404207423233, 'loss_target_clip': 5.0, 'jerk_loss_coef': 0.0004761452033727859, 'use_channel_adjacency_prior': False}. Best is trial 6 with value: 2.4769127368927.
[I 2025-07-27 21:12:15,943] Trial 11 finished with value: 2.4831559658050537 and parameters: {'seq_len': 48, 'norm_mode': 'subtract_median', 'lr': 0.0018682728931823482, 'd_model': 512, 'd_ff': 128, 'e_layers': 2, 'moving_avg': 97, 'n_heads': 1, 'dropout': 0.031081897252458534, 'fc_dropout': 0.1246378948471369, 'batch_size': 256, 'loss_coef': 0.16622273582274275, 'loss_function': 'crps', 'use_agc': True, 'agc_lambda': 0.008136639708640373, 'num_linear_experts': 4, 'num_univariate_esn_experts': 4, 'num_multivariate_esn_experts': 2, 'k': 9, 'hidden_size': 512, 'reservoir_size_uni': 256, 'spectral_radius_uni': 0.6869488256239484, 'sparsity_uni': 0.2252184746901049, 'leak_rate_uni': 0.5985872805261063, 'input_scaling_uni': 0.332367613647569, 'esn_uni_weight_decay': 2.3986920238131313e-06, 'reservoir_size_multi': 256, 'spectral_radius_multi': 0.8347947063615707, 'sparsity_multi': 0.2829305364954448, 'leak_rate_multi': 0.5483857412969081, 'input_scaling_multi': 0.46484669921024097, 'esn_multi_weight_decay': 4.71767213085866e-05, 'projection_head_layers': 4, 'projection_head_dim_factor': 4, 'projection_head_dropout': 0.043169365493366925, 'loss_target_clip': 5.0, 'jerk_loss_coef': 0.00662727474011457, 'use_channel_adjacency_prior': False}. Best is trial 6 with value: 2.4769127368927.
[I 2025-07-27 21:18:04,099] Trial 14 finished with value: 14.680610656738281 and parameters: {'seq_len': 192, 'norm_mode': 'subtract_median', 'lr': 1.9641967736549465e-05, 'd_model': 64, 'd_ff': 64, 'e_layers': 2, 'moving_avg': 193, 'n_heads': 1, 'dropout': 0.30617862915387695, 'fc_dropout': 0.30132029280137085, 'batch_size': 512, 'loss_coef': 0.4458911897277699, 'loss_function': 'crps', 'use_agc': True, 'agc_lambda': 0.0019098416386150608, 'num_linear_experts': 6, 'num_univariate_esn_experts': 4, 'num_multivariate_esn_experts': 7, 'k': 3, 'hidden_size': 128, 'reservoir_size_uni': 64, 'spectral_radius_uni': 1.1348329611901238, 'sparsity_uni': 0.26118572253175454, 'leak_rate_uni': 0.7859842014326412, 'input_scaling_uni': 0.14002092505550537, 'esn_uni_weight_decay': 0.0004171016266778198, 'reservoir_size_multi': 128, 'spectral_radius_multi': 1.1951617753169295, 'sparsity_multi': 0.23068670369702818, 'leak_rate_multi': 0.9041567096938715, 'input_scaling_multi': 0.025761014717362453, 'esn_multi_weight_decay': 0.0009847717597101183, 'projection_head_layers': 0, 'loss_target_clip': 10.0, 'jerk_loss_coef': 0.0005599069463625735, 'use_channel_adjacency_prior': False}. Best is trial 6 with value: 2.4769127368927.
[I 2025-07-27 21:21:25,320] Trial 3 finished with value: 2.478060483932495 and parameters: {'seq_len': 48, 'norm_mode': 'subtract_median', 'lr': 0.0008605360326555651, 'd_model': 512, 'd_ff': 128, 'e_layers': 2, 'moving_avg': 97, 'n_heads': 2, 'dropout': 0.08354823354484386, 'fc_dropout': 0.10203105653571898, 'batch_size': 128, 'loss_coef': 0.187904496840974, 'loss_function': 'crps', 'use_agc': True, 'agc_lambda': 0.00756937624402596, 'num_linear_experts': 4, 'num_univariate_esn_experts': 5, 'num_multivariate_esn_experts': 2, 'k': 10, 'hidden_size': 512, 'reservoir_size_uni': 64, 'spectral_radius_uni': 0.8524029915859183, 'sparsity_uni': 0.35752443217997315, 'leak_rate_uni': 0.6887125029280805, 'input_scaling_uni': 0.3868161172348993, 'esn_uni_weight_decay': 0.010231553172756288, 'reservoir_size_multi': 32, 'spectral_radius_multi': 0.7115061204325002, 'sparsity_multi': 0.30237269525978594, 'leak_rate_multi': 0.6016088987086231, 'input_scaling_multi': 0.4479674582849533, 'esn_multi_weight_decay': 5.3831988922890375e-05, 'projection_head_layers': 4, 'projection_head_dim_factor': 4, 'projection_head_dropout': 0.15243404207423233, 'loss_target_clip': 5.0, 'jerk_loss_coef': 0.0004761452033727859, 'use_channel_adjacency_prior': False}. Best is trial 6 with value: 2.4769127368927.
[I 2025-07-27 21:24:54,772] Trial 5 finished with value: 3.04862380027771 and parameters: {'seq_len': 96, 'norm_mode': 'subtract_median', 'lr': 0.007634543984860757, 'd_model': 512, 'd_ff': 512, 'e_layers': 3, 'moving_avg': 49, 'n_heads': 2, 'dropout': 0.4181159394885853, 'fc_dropout': 0.2241914651090713, 'batch_size': 1024, 'loss_coef': 0.17079658142285847, 'loss_function': 'crps', 'use_agc': False, 'num_linear_experts': 2, 'num_univariate_esn_experts': 4, 'num_multivariate_esn_experts': 8, 'k': 6, 'hidden_size': 128, 'reservoir_size_uni': 16, 'spectral_radius_uni': 1.157704023403662, 'sparsity_uni': 0.4627077313755891, 'leak_rate_uni': 0.8773773373005375, 'input_scaling_uni': 0.22733823262615188, 'esn_uni_weight_decay': 0.012039163925678407, 'reservoir_size_multi': 16, 'spectral_radius_multi': 0.7699925451872774, 'sparsity_multi': 0.353027841739084, 'leak_rate_multi': 0.65058369895222, 'input_scaling_multi': 0.24066961159786396, 'esn_multi_weight_decay': 0.0014010630594118998, 'projection_head_layers': 3, 'projection_head_dim_factor': 1, 'projection_head_dropout': 0.33699775331795906, 'loss_target_clip': None, 'jerk_loss_coef': 0.18080202001548082, 'use_channel_adjacency_prior': True}. Best is trial 6 with value: 2.4769127368927.
[I 2025-07-27 21:27:08,634] Trial 17 pruned. 
[I 2025-07-27 21:28:57,077] Trial 12 pruned. 
[I 2025-07-27 22:14:55,226] Trial 19 pruned. 
[I 2025-07-27 22:15:03,069] Trial 18 pruned. 
[I 2025-07-27 23:14:32,165] Trial 22 pruned. 
[I 2025-07-27 23:23:03,380] Trial 21 pruned. 
[I 2025-07-27 23:30:58,257] Trial 27 pruned. 
[I 2025-07-27 23:47:50,816] Trial 28 pruned. 
[I 2025-07-28 00:04:11,849] Trial 26 pruned. 
[I 2025-07-28 00:34:18,192] Trial 30 pruned. 
[I 2025-07-28 00:48:25,755] Trial 31 pruned. 
[I 2025-07-28 00:51:36,860] Trial 29 finished with value: 2.4542365074157715 and parameters: {'seq_len': 48, 'norm_mode': 'subtract_median', 'lr': 0.0004237133188680206, 'd_model': 512, 'd_ff': 128, 'e_layers': 2, 'moving_avg': 97, 'n_heads': 2, 'dropout': 0.0073618027434861205, 'fc_dropout': 0.04111227992574204, 'batch_size': 128, 'loss_coef': 1.8807396808022647, 'loss_function': 'crps', 'use_agc': True, 'agc_lambda': 0.0037332008888313426, 'num_linear_experts': 3, 'num_univariate_esn_experts': 3, 'num_multivariate_esn_experts': 3, 'k': 7, 'hidden_size': 512, 'reservoir_size_uni': 32, 'spectral_radius_uni': 0.6048115731282476, 'sparsity_uni': 0.23432214898473808, 'leak_rate_uni': 0.7793052022480177, 'input_scaling_uni': 0.3303425849011713, 'esn_uni_weight_decay': 2.577671171946397e-05, 'reservoir_size_multi': 32, 'spectral_radius_multi': 0.6565880966384123, 'sparsity_multi': 0.4007924564041798, 'leak_rate_multi': 0.12733719974654584, 'input_scaling_multi': 0.9387905833384286, 'esn_multi_weight_decay': 1.1936224166914605e-05, 'projection_head_layers': 4, 'projection_head_dim_factor': 4, 'projection_head_dropout': 0.23147637598042708, 'loss_target_clip': 5.0, 'jerk_loss_coef': 0.0001207749116518875, 'use_channel_adjacency_prior': False}. Best is trial 29 with value: 2.4542365074157715.
[I 2025-07-28 01:27:36,911] Trial 25 finished with value: 2.299513578414917 and parameters: {'seq_len': 48, 'norm_mode': 'subtract_last', 'lr': 0.0003372257792303186, 'd_model': 64, 'd_ff': 256, 'e_layers': 3, 'moving_avg': 97, 'n_heads': 2, 'dropout': 0.2344782036268636, 'fc_dropout': 0.2013853511960489, 'batch_size': 1024, 'loss_coef': 0.10654195351149667, 'loss_function': 'crps', 'use_agc': True, 'agc_lambda': 0.0020865725796855175, 'num_linear_experts': 5, 'num_univariate_esn_experts': 6, 'num_multivariate_esn_experts': 4, 'k': 13, 'hidden_size': 64, 'reservoir_size_uni': 32, 'spectral_radius_uni': 0.8804470511933744, 'sparsity_uni': 0.04988549516978147, 'leak_rate_uni': 0.45105214231940427, 'input_scaling_uni': 0.6949404277116538, 'esn_uni_weight_decay': 0.0012878321881726704, 'reservoir_size_multi': 32, 'spectral_radius_multi': 0.6088396231518921, 'sparsity_multi': 0.155612776278171, 'leak_rate_multi': 0.35666870436112275, 'input_scaling_multi': 0.06721592917118381, 'esn_multi_weight_decay': 1.2017479894492605e-05, 'projection_head_layers': 2, 'projection_head_dim_factor': 2, 'projection_head_dropout': 0.2525152827014696, 'loss_target_clip': 5.0, 'jerk_loss_coef': 0.0015710535003278043, 'use_channel_adjacency_prior': False}. Best is trial 25 with value: 2.299513578414917.
[I 2025-07-28 01:31:53,594] Trial 34 pruned. 
[I 2025-07-28 01:32:56,385] Trial 24 finished with value: 2.2729692459106445 and parameters: {'seq_len': 48, 'norm_mode': 'subtract_last', 'lr': 0.0002145037554778002, 'd_model': 64, 'd_ff': 256, 'e_layers': 3, 'moving_avg': 97, 'n_heads': 2, 'dropout': 0.21598975648074314, 'fc_dropout': 0.20231082691772453, 'batch_size': 128, 'loss_coef': 0.10693677017186816, 'loss_function': 'crps', 'use_agc': False, 'num_linear_experts': 2, 'num_univariate_esn_experts': 6, 'num_multivariate_esn_experts': 4, 'k': 8, 'hidden_size': 64, 'reservoir_size_uni': 128, 'spectral_radius_uni': 0.9071455954749569, 'sparsity_uni': 0.04935445323991389, 'leak_rate_uni': 0.40959658928233383, 'input_scaling_uni': 0.739536246704724, 'esn_uni_weight_decay': 0.001385253578352309, 'reservoir_size_multi': 32, 'spectral_radius_multi': 0.6085848335814064, 'sparsity_multi': 0.1625227041305618, 'leak_rate_multi': 0.3633343576988267, 'input_scaling_multi': 0.06452834037752866, 'esn_multi_weight_decay': 5.199219968746022e-06, 'projection_head_layers': 3, 'projection_head_dim_factor': 2, 'projection_head_dropout': 0.2549114925861222, 'loss_target_clip': 5.0, 'jerk_loss_coef': 0.0016562108448921137, 'use_channel_adjacency_prior': True}. Best is trial 24 with value: 2.2729692459106445.
