[I 2025-07-28 01:37:41,590] Trial 32 finished with value: 2.900815963745117 and parameters: {'seq_len': 48, 'norm_mode': 'subtract_median', 'lr': 0.0031700249596159666, 'd_model': 32, 'd_ff': 128, 'e_layers': 1, 'moving_avg': 97, 'n_heads': 2, 'dropout': 0.07645721254850389, 'fc_dropout': 0.25060463534020677, 'batch_size': 128, 'loss_coef': 0.7448699952802432, 'loss_function': 'gfl', 'gfl_gamma': 0.6896388715946467, 'use_agc': True, 'agc_lambda': 0.00561767753641936, 'num_linear_experts': 0, 'num_univariate_esn_experts': 5, 'num_multivariate_esn_experts': 5, 'k': 9, 'hidden_size': 128, 'reservoir_size_uni': 16, 'spectral_radius_uni': 0.9919299201366858, 'sparsity_uni': 0.09920117692253677, 'leak_rate_uni': 0.12684555018871552, 'input_scaling_uni': 0.2877165090169812, 'esn_uni_weight_decay': 0.0005505050751600039, 'reservoir_size_multi': 32, 'spectral_radius_multi': 0.6667621015557631, 'sparsity_multi': 0.24983559209115425, 'leak_rate_multi': 0.4552584924161719, 'input_scaling_multi': 0.46897153848226336, 'esn_multi_weight_decay': 0.0003564762546994523, 'projection_head_layers': 3, 'projection_head_dim_factor': 4, 'projection_head_dropout': 0.4133440057210768, 'loss_target_clip': 5.0, 'jerk_loss_coef': 0.9933685951549908, 'use_channel_adjacency_prior': False}. Best is trial 24 with value: 2.2729692459106445.
  File "/workspace/ts_proba_cuda/optuna_full_search.py", line 44
    "data_file": "eisbach_airtemp96_pressure96.csv, 
          File "/workspace/ts_proba_cuda/optuna_full_search.py", line 44
       "data_file": "eisbach_airtemp96_pressure96.csv,   File "/workspace/ts_proba_cuda/optuna_full_search.py", line 44
 
         "data_file": "eisbach_airtemp96_pressure96.csv,   
            ^  
  SyntaxError  :   unterminated string literal (detected at line 44)   
        ^ 
^SyntaxError
: SyntaxErrorunterminated string literal (detected at line 44): 
unterminated string literal (detected at line 44)
  File "/workspace/ts_proba_cuda/optuna_full_search.py", line 44
    "data_file": "eisbach_airtemp96_pressure96.csv, 
                 ^
SyntaxError: unterminated string literal (detected at line 44)
  File "/workspace/ts_proba_cuda/optuna_full_search.py", line 44
    "data_file": "eisbach_airtemp96_pressure96.csv, 
      File "/workspace/ts_proba_cuda/optuna_full_search.py", line 44
   File "/workspace/ts_proba_cuda/optuna_full_search.py", line 44
          "data_file": "eisbach_airtemp96_pressure96.csv,  "data_file": "eisbach_airtemp96_pressure96.csv, 
     
                           ^  
  SyntaxError  :   unterminated string literal (detected at line 44)  
 ^^

SyntaxErrorSyntaxError: : unterminated string literal (detected at line 44)unterminated string literal (detected at line 44)

  File "/workspace/ts_proba_cuda/optuna_full_search.py", line 44
    "data_file": "eisbach_airtemp96_pressure96.csv, 
                 ^
SyntaxError: unterminated string literal (detected at line 44)
  File "/workspace/ts_proba_cuda/optuna_full_search.py", line 44
    "data_file": "eisbach_airtemp96_pressure96.csv, 
           File "/workspace/ts_proba_cuda/optuna_full_search.py", line 44
       "data_file": "eisbach_airtemp96_pressure96.csv,  
           ^ 
 SyntaxError :  unterminated string literal (detected at line 44) 
     ^
SyntaxError: unterminated string literal (detected at line 44)
  File "/workspace/ts_proba_cuda/optuna_full_search.py", line 44
    "data_file": "eisbach_airtemp96_pressure96.csv, 
                 ^
SyntaxError: unterminated string literal (detected at line 44)
  File "/workspace/ts_proba_cuda/optuna_full_search.py", line 44
    "data_file": "eisbach_airtemp96_pressure96.csv, 
                 ^
SyntaxError: unterminated string literal (detected at line 44)
  File "/workspace/ts_proba_cuda/optuna_full_search.py", line 44
    "data_file": "eisbach_airtemp96_pressure96.csv, 
                 ^
SyntaxError: unterminated string literal (detected at line 44)  File "/workspace/ts_proba_cuda/optuna_full_search.py", line 44

    "data_file": "eisbach_airtemp96_pressure96.csv, 
                 ^
SyntaxError: unterminated string literal (detected at line 44)
  File "/workspace/ts_proba_cuda/optuna_full_search.py", line 44
  File "/workspace/ts_proba_cuda/optuna_full_search.py", line 44
        "data_file": "eisbach_airtemp96_pressure96.csv, "data_file": "eisbach_airtemp96_pressure96.csv, 

                                  ^^

SyntaxErrorSyntaxError: : unterminated string literal (detected at line 44)unterminated string literal (detected at line 44)

[I 2025-07-28 01:53:38,842] A new study created in RDB with name: eisbach_airtemp_pressure_focus_auf_wassertemp
[I 2025-07-28 01:53:38,848] Using an existing study with name 'eisbach_airtemp_pressure_focus_auf_wassertemp' instead of creating a new one.
[I 2025-07-28 01:53:38,848] Using an existing study with name 'eisbach_airtemp_pressure_focus_auf_wassertemp' instead of creating a new one.
[I 2025-07-28 01:53:38,883] Using an existing study with name 'eisbach_airtemp_pressure_focus_auf_wassertemp' instead of creating a new one.
[I 2025-07-28 02:02:28,132] A new study created in RDB with name: eisbach_airtemp_pressure_focus_auf_wassertemp_2
[I 2025-07-28 02:02:28,138] Using an existing study with name 'eisbach_airtemp_pressure_focus_auf_wassertemp_2' instead of creating a new one.
[I 2025-07-28 02:02:28,139] Using an existing study with name 'eisbach_airtemp_pressure_focus_auf_wassertemp_2' instead of creating a new one.
[I 2025-07-28 02:02:28,140] Using an existing study with name 'eisbach_airtemp_pressure_focus_auf_wassertemp_2' instead of creating a new one.
[I 2025-07-28 02:03:55,081] Using an existing study with name 'eisbach_airtemp_pressure_focus_auf_wassertemp' instead of creating a new one.
[I 2025-07-28 02:03:55,087] Using an existing study with name 'eisbach_airtemp_pressure_focus_auf_wassertemp' instead of creating a new one.
[I 2025-07-28 02:03:55,088] Using an existing study with name 'eisbach_airtemp_pressure_focus_auf_wassertemp' instead of creating a new one.
[I 2025-07-28 02:03:55,088] Using an existing study with name 'eisbach_airtemp_pressure_focus_auf_wassertemp' instead of creating a new one.
